{
  "domain": "platform-gatekeeper-reporting",
  "service": "major-event-remediation-reporting",
  "version": 1,
  "generated_at": "2026-09-27T09:00:00",
  "incidents": [
    {
      "id": "INC-0001",
      "title": "流量分配实验导致中小商家曝光歧视",
      "level": "重大",
      "domains": [
        "算法",
        "流量"
      ],
      "status": "已关闭",
      "reporter": "流量值班工程师（历史）",
      "first_detected_at": "2026-03-10T07:40:00",
      "report_deadline": "2026-03-10T09:40:00",
      "reported_at": "2026-03-10T08:00:00",
      "merged_report_ids": [
        "R-2026-0310-01"
      ],
      "source_team_reports": [
        {
          "report_id": "R-2026-0310-01",
          "team": "流量与推荐团队",
          "reporter": "流量值班工程师（历史）",
          "occurred_at": "2026-03-10T07:20:00",
          "rule_versions": [
            "ranking-model@v291"
          ],
          "keywords": [
            "流量",
            "算法",
            "歧视"
          ],
          "summary": "实验组流量分配对中小商家形成系统性曝光歧视",
          "merged_at": "2026-03-10T08:00:00"
        }
      ],
      "frozen_at": "2026-03-10T08:30:00",
      "frozen_by": "合规值班经理（历史）",
      "frozen": {
        "affected_window": {
          "start": "2026-03-10T06:00:00",
          "end": "2026-03-10T07:55:00"
        },
        "rule_versions": [
          "ranking-model@v291",
          "traffic-policy@v108"
        ],
        "affected_subjects": {
          "merchants": 620,
          "merchant_type": "中小商家",
          "regions": [
            "华东",
            "西南"
          ]
        },
        "interim_measures": [
          "停止实验分组",
          "恢复v290排序策略",
          "开放商家申诉专线"
        ]
      },
      "freeze_revisions": [],
      "actions": [
        {
          "kind": "根因调查",
          "owner_team": "算法治理组",
          "status": "已关闭",
          "commitment": {
            "action_kind": "根因调查",
            "content": "查明实验分流缺陷",
            "due_at": "2026-03-11T18:00:00",
            "owner_team": "算法治理组"
          },
          "completed_at": "2026-03-11T15:00:00",
          "submitted_by": "算法工程师（历史）",
          "submitted_at": "2026-03-11T15:00:00",
          "evidence": {
            "id": "ATT-INC-0001-001",
            "name": "实验分流根因报告（脱敏）",
            "contains_trade_secret": false,
            "visibility": "内部",
            "redacted_view": "根因为实验哈希桶在特定商家规模上分布失衡",
            "controlled_ref": "",
            "uploaded_by": "算法工程师（历史）",
            "uploaded_at": "2026-03-11T15:00:00",
            "authorized_reviewers": []
          },
          "reviews": [
            {
              "reviewer": "合规审签人甲",
              "approved": true,
              "at": "2026-03-11T15:00:00",
              "note": "根因清晰"
            }
          ]
        },
        {
          "kind": "用户补救",
          "owner_team": "商家服务组",
          "status": "已关闭",
          "commitment": {
            "action_kind": "用户补救",
            "content": "补偿受影响商家流量券",
            "due_at": "2026-03-12T18:00:00",
            "owner_team": "商家服务组"
          },
          "completed_at": "2026-03-12T16:00:00",
          "submitted_by": "商家服务专员（历史）",
          "submitted_at": "2026-03-12T16:00:00",
          "evidence": {
            "id": "ATT-INC-0001-002",
            "name": "流量券补发清单（汇总）",
            "contains_trade_secret": false,
            "visibility": "内部",
            "redacted_view": "已向620家商家补发等值流量券",
            "controlled_ref": "",
            "uploaded_by": "商家服务专员（历史）",
            "uploaded_at": "2026-03-12T16:00:00",
            "authorized_reviewers": []
          },
          "reviews": [
            {
              "reviewer": "合规审签人甲",
              "approved": true,
              "at": "2026-03-12T16:00:00",
              "note": ""
            }
          ]
        },
        {
          "kind": "制度修订",
          "owner_team": "平台规则组",
          "status": "已关闭",
          "commitment": {
            "action_kind": "制度修订",
            "content": "修订实验上线灰度规则",
            "due_at": "2026-03-13T18:00:00",
            "owner_team": "平台规则组"
          },
          "completed_at": "2026-03-13T10:00:00",
          "submitted_by": "规则专员（历史）",
          "submitted_at": "2026-03-13T10:00:00",
          "evidence": {
            "id": "ATT-INC-0001-003",
            "name": "灰度发布规则修订文本",
            "contains_trade_secret": false,
            "visibility": "内部",
            "redacted_view": "新增实验组商家覆盖比例上限与公平性观测卡口",
            "controlled_ref": "",
            "uploaded_by": "规则专员（历史）",
            "uploaded_at": "2026-03-13T10:00:00",
            "authorized_reviewers": []
          },
          "reviews": [
            {
              "reviewer": "合规审签人甲",
              "approved": true,
              "at": "2026-03-13T10:00:00",
              "note": ""
            }
          ]
        },
        {
          "kind": "复测",
          "owner_team": "质量与风控组",
          "status": "已关闭",
          "commitment": {
            "action_kind": "复测",
            "content": "对流量分配公平性复测",
            "due_at": "2026-03-14T18:00:00",
            "owner_team": "质量与风控组"
          },
          "completed_at": "2026-03-14T11:00:00",
          "submitted_by": "复测工程师（历史）",
          "submitted_at": "2026-03-14T11:00:00",
          "evidence": {
            "id": "ATT-INC-0001-004",
            "name": "流量公平性复测报告",
            "contains_trade_secret": false,
            "visibility": "内部",
            "redacted_view": "连续24小时分组曝光差异回落至阈值内",
            "controlled_ref": "",
            "uploaded_by": "复测工程师（历史）",
            "uploaded_at": "2026-03-14T11:00:00",
            "authorized_reviewers": []
          },
          "reviews": [
            {
              "reviewer": "合规审签人甲",
              "approved": true,
              "at": "2026-03-14T11:00:00",
              "note": ""
            }
          ]
        }
      ],
      "regulator_summary": "历史事件：四条整改线均已审签通过，复测无异常，事件关闭。",
      "recurrence_links": [
        "INC-0002"
      ],
      "created_from_lead_id": null,
      "closed_at": "2026-03-14T11:00:00"
    },
    {
      "id": "INC-0002",
      "title": "排序模型回滚引发商家申诉失败、补贴错发与流量歧视",
      "level": "重大",
      "domains": [
        "数据",
        "算法",
        "流量",
        "规则"
      ],
      "status": "整改中",
      "reporter": "算法值班工程师",
      "first_detected_at": "2026-09-20T01:12:00",
      "report_deadline": "2026-09-20T03:12:00",
      "reported_at": "2026-09-20T01:40:00",
      "merged_report_ids": [
        "R-2026-0920-01",
        "R-2026-0920-02",
        "R-2026-0920-03"
      ],
      "source_team_reports": [
        {
          "report_id": "R-2026-0920-01",
          "team": "算法团队",
          "reporter": "算法值班工程师",
          "occurred_at": "2026-09-20T01:05:00",
          "rule_versions": [
            "ranking-model@v318",
            "subsidy-rule@v204"
          ],
          "keywords": [
            "算法",
            "回滚",
            "流量"
          ],
          "summary": "v318排序模型回滚后申诉链路与补贴规则同时异常",
          "merged_at": "2026-09-20T01:40:00"
        },
        {
          "report_id": "R-2026-0920-02",
          "team": "商家治理团队",
          "reporter": "商家治理值班",
          "occurred_at": "2026-09-20T01:30:00",
          "rule_versions": [
            "appeal-flow@v57",
            "subsidy-rule@v204"
          ],
          "keywords": [
            "申诉",
            "补贴",
            "价格"
          ],
          "summary": "申诉状态机卡单，补贴按旧价规则错发",
          "merged_at": "2026-09-20T03:10:00"
        },
        {
          "report_id": "R-2026-0920-03",
          "team": "流量与推荐团队",
          "reporter": "流量值班工程师",
          "occurred_at": "2026-09-20T01:40:00",
          "rule_versions": [
            "ranking-model@v318",
            "traffic-policy@v112"
          ],
          "keywords": [
            "流量",
            "歧视",
            "算法"
          ],
          "summary": "v318回滚后流量分发对中小商家不友好",
          "merged_at": "2026-09-20T03:40:00"
        }
      ],
      "frozen_at": "2026-09-20T02:30:00",
      "frozen_by": "合规值班经理",
      "frozen": {
        "affected_window": {
          "start": "2026-09-20T00:50:00",
          "end": "2026-09-20T02:10:00"
        },
        "rule_versions": [
          "appeal-flow@v57",
          "ranking-model@v318",
          "subsidy-rule@v204",
          "traffic-policy@v112"
        ],
        "affected_subjects": {
          "merchants": 1340,
          "consumers": 91200,
          "merchant_types": [
            "品牌商家",
            "中小商家"
          ],
          "channels": [
            "商家申诉",
            "价格补贴",
            "搜索流量"
          ]
        },
        "interim_measures": [
          "排序回滚至 ranking-model@v317",
          "暂停补贴自动发放，改人工复核",
          "积压申诉转人工通道限时处理",
          "启用补贴垫付通道，对受影响商家先行赔付"
        ]
      },
      "freeze_revisions": [
        {
          "field": "rule_versions",
          "field_label": "规则/算法版本",
          "before": [
            "ranking-model@v318",
            "appeal-flow@v57",
            "subsidy-rule@v204"
          ],
          "after": [
            "appeal-flow@v57",
            "ranking-model@v318",
            "subsidy-rule@v204"
          ],
          "reason": "归并团队 商家治理团队 上报，补充规则/算法版本",
          "by": "商家治理值班",
          "at": "2026-09-20T03:10:00"
        },
        {
          "field": "rule_versions",
          "field_label": "规则/算法版本",
          "before": [
            "appeal-flow@v57",
            "ranking-model@v318",
            "subsidy-rule@v204"
          ],
          "after": [
            "appeal-flow@v57",
            "ranking-model@v318",
            "subsidy-rule@v204",
            "traffic-policy@v112"
          ],
          "reason": "归并团队 流量与推荐团队 上报，补充规则/算法版本",
          "by": "流量值班工程师",
          "at": "2026-09-20T03:40:00"
        },
        {
          "field": "interim_measures",
          "field_label": "临时措施",
          "before": [
            "排序回滚至 ranking-model@v317",
            "暂停补贴自动发放，改人工复核",
            "积压申诉转人工通道限时处理"
          ],
          "after": [